{
  "$schema": "https://json-schema.org/draft/2020-12/schema",
  "$id": "https://the-door.dev/schemas/ast-raw.schema.json",
  "title": "The Door Structure JSON",
  "description": "AST structure extraction output with topology analysis",
  "type": "object",
  "required": [
    "files",
    "nodes",
    "edges",
    "topology"
  ],
  "properties": {
    "files": {
      "type": "array",
      "items": {
        "type": "object",
        "required": [
          "path",
          "language"
        ],
        "properties": {
          "path": {
            "type": "string"
          },
          "language": {
            "type": "string"
          }
        }
      }
    },
    "nodes": {
      "type": "array",
      "items": {
        "type": "object",
        "required": [
          "node_id",
          "type",
          "name",
          "file",
          "language",
          "decorators",
          "parameters",
          "return_type",
          "docstring",
          "comments"
        ],
        "properties": {
          "node_id": {
            "type": "string"
          },
          "type": {
            "type": "string",
            "enum": [
              "function",
              "class",
              "method"
            ]
          },
          "name": {
            "type": "string"
          },
          "file": {
            "type": "string"
          },
          "language": {
            "type": "string"
          },
          "decorators": {
            "type": "array",
            "items": {
              "type": "string"
            }
          },
          "parameters": {
            "type": "array",
            "items": {
              "type": "string"
            }
          },
          "return_type": {
            "type": [
              "string",
              "null"
            ]
          },
          "docstring": {
            "type": [
              "string",
              "null"
            ]
          },
          "comments": {
            "type": "array",
            "items": {
              "type": "string"
            }
          }
        }
      }
    },
    "edges": {
      "type": "array",
      "items": {
        "type": "object",
        "required": [
          "from",
          "to",
          "type"
        ],
        "properties": {
          "from": {
            "type": "string"
          },
          "to": {
            "type": "string"
          },
          "type": {
            "type": "string",
            "enum": [
              "calls",
              "imports",
              "extends",
              "implements"
            ]
          }
        }
      }
    },
    "topology": {
      "type": "array",
      "items": {
        "type": "object",
        "required": [
          "node_id",
          "in_degree",
          "out_degree",
          "topology_rank",
          "is_entry_point",
          "batch_assignment"
        ],
        "properties": {
          "node_id": {
            "type": "string"
          },
          "in_degree": {
            "type": "integer",
            "minimum": 0
          },
          "out_degree": {
            "type": "integer",
            "minimum": 0
          },
          "topology_rank": {
            "type": "integer",
            "minimum": 1
          },
          "is_entry_point": {
            "type": "boolean"
          },
          "batch_assignment": {
            "type": "integer",
            "minimum": 1
          }
        }
      }
    },
    "vulnerabilities": {
      "type": "array",
      "default": [],
      "items": {
        "type": "object",
        "required": [
          "cve_id",
          "package",
          "version",
          "severity",
          "cvss",
          "source"
        ],
        "properties": {
          "cve_id": {
            "type": "string"
          },
          "package": {
            "type": "string"
          },
          "version": {
            "type": "string"
          },
          "severity": {
            "type": "string",
            "enum": [
              "critical",
              "high",
              "medium",
              "low"
            ]
          },
          "cvss": {
            "type": "number",
            "minimum": 0.0,
            "maximum": 10.0
          },
          "source": {
            "type": "string"
          }
        }
      }
    },
    "vulnerability_db_freshness": {
      "type": [
        "object",
        "null"
      ],
      "properties": {
        "timestamp": {
          "type": "string",
          "format": "date-time"
        },
        "mode": {
          "type": "string",
          "enum": [
            "online",
            "offline"
          ]
        },
        "stale_warning": {
          "type": [
            "string",
            "null"
          ]
        }
      }
    }
  }
}
